<?xml version="1.0" encoding="UTF-8"?>
<fits xmlns="http://hul.harvard.edu/ois/xml/ns/fits/fits_output" xmlns:xsi="http://www.w3.org/2001/XMLSchema-instance" xsi:schemaLocation="http://hul.harvard.edu/ois/xml/ns/fits/fits_output https://some-other-pid-service/fits_output.xsd" version="1.6.0-SNAPSHOT" timestamp="1/12/23, 8:29 PM">
  <identification status="SINGLE_RESULT">
    <identity format="TEI" mimetype="application/tei+xml" toolname="FITS" toolversion="1.6.0-SNAPSHOT">
      <tool toolname="Droid" toolversion="6.5.2" />
      <version toolname="Droid" toolversion="6.5.2">P5</version>
      <externalIdentifier toolname="Droid" toolversion="6.5.2" type="puid">fmt/1476</externalIdentifier>
    </identity>
  </identification>
  <fileinfo>
    <size toolname="Jhove" toolversion="1.26.1">235257</size>
    <filepath toolname="OIS File Information" toolversion="1.0" status="SINGLE_RESULT">/fits/testfiles/input/P3EKWCX2XYWWB8Y.xml</filepath>
    <filename toolname="OIS File Information" toolversion="1.0" status="SINGLE_RESULT">P3EKWCX2XYWWB8Y.xml</filename>
    <md5checksum toolname="OIS File Information" toolversion="1.0" status="SINGLE_RESULT">e4cf29a87057861c560d4d1f0f9491c2</md5checksum>
    <fslastmodified toolname="OIS File Information" toolversion="1.0" status="SINGLE_RESULT">1667144387819</fslastmodified>
  </fileinfo>
  <filestatus>
    <well-formed toolname="Jhove" toolversion="1.26.1" status="SINGLE_RESULT">true</well-formed>
    <valid toolname="Jhove" toolversion="1.26.1" status="SINGLE_RESULT">true</valid>
  </filestatus>
  <metadata>
    <text>
      <charset toolname="Jhove" toolversion="1.26.1">UTF-8</charset>
      <markupBasis toolname="Jhove" toolversion="1.26.1">XML</markupBasis>
      <markupBasisVersion toolname="Jhove" toolversion="1.26.1">1.0</markupBasisVersion>
      <standard>
        <textMD:textMD xmlns:textMD="info:lc/xmlns/textMD-v3">
          <textMD:character_info>
            <textMD:charset>UTF-8</textMD:charset>
          </textMD:character_info>
          <textMD:markup_basis version="1.0">XML</textMD:markup_basis>
        </textMD:textMD>
      </standard>
    </text>
  </metadata>
  <statistics fitsExecutionTime="586">
    <tool toolname="MediaInfo" toolversion="22.09" status="did not run" />
    <tool toolname="OIS Audio Information" toolversion="0.1" status="did not run" />
    <tool toolname="ADL Tool" toolversion="0.1" status="did not run" />
    <tool toolname="VTT Tool" toolversion="0.1" status="did not run" />
    <tool toolname="Droid" toolversion="6.5.2" executionTime="108" />
    <tool toolname="jpylyzer" toolversion="2.1.0" status="did not run" />
    <tool toolname="Jhove" toolversion="1.26.1" executionTime="208" />
    <tool toolname="embARC" toolversion="0.2" status="did not run" />
    <tool toolname="file utility" toolversion="5.43" executionTime="177" />
    <tool toolname="Exiftool" toolversion="12.50" executionTime="419" />
    <tool toolname="NLNZ Metadata Extractor" toolversion="3.6GA" executionTime="566" />
    <tool toolname="OIS File Information" toolversion="1.0" executionTime="108" />
    <tool toolname="OIS XML Metadata" toolversion="0.2" executionTime="157" />
    <tool toolname="ffident" toolversion="0.2" executionTime="134" />
    <tool toolname="Tika" toolversion="2.6.0" executionTime="137" />
  </statistics>
</fits>
