<?xml version="1.0" encoding="UTF-8"?>
<fits xmlns="http://hul.harvard.edu/ois/xml/ns/fits/fits_output" xmlns:xsi="http://www.w3.org/2001/XMLSchema-instance" xsi:schemaLocation="http://hul.harvard.edu/ois/xml/ns/fits/fits_output https://some-other-pid-service/fits_output.xsd" version="1.6.0-SNAPSHOT" timestamp="1/12/23, 8:26 PM">
  <identification>
    <identity format="EPUB" mimetype="application/epub+zip" toolname="FITS" toolversion="1.6.0-SNAPSHOT">
      <tool toolname="Droid" toolversion="6.5.2" />
      <tool toolname="Exiftool" toolversion="12.50" />
      <tool toolname="Tika" toolversion="2.6.0" />
      <externalIdentifier toolname="Droid" toolversion="6.5.2" type="puid">fmt/483</externalIdentifier>
    </identity>
  </identification>
  <fileinfo>
    <created toolname="Tika" toolversion="2.6.0" status="SINGLE_RESULT">1954</created>
    <filepath toolname="OIS File Information" toolversion="1.0" status="SINGLE_RESULT">/fits/testfiles/input/Winnie-the-Pooh-protected.epub</filepath>
    <filename toolname="OIS File Information" toolversion="1.0" status="SINGLE_RESULT">Winnie-the-Pooh-protected.epub</filename>
    <size toolname="OIS File Information" toolversion="1.0">15107043</size>
    <md5checksum toolname="OIS File Information" toolversion="1.0" status="SINGLE_RESULT">4ccb561ddebda70324926895899cd27c</md5checksum>
    <fslastmodified toolname="OIS File Information" toolversion="1.0" status="SINGLE_RESULT">1667144388006</fslastmodified>
  </fileinfo>
  <filestatus />
  <metadata>
    <document>
      <isRightsManaged toolname="Tika" toolversion="2.8.0" status="SINGLE_RESULT">yes</isRightsManaged>
      <identifier toolname="Tika" toolversion="2.8.0" status="SINGLE_RESULT">1-101-15893-X</identifier>
      <language toolname="Tika" toolversion="2.8.0" status="SINGLE_RESULT">en</language>
      <author toolname="Tika" toolversion="2.8.0" status="SINGLE_RESULT">A. A. Milne</author>
      <title toolname="Tika" toolversion="2.8.0" status="SINGLE_RESULT">Winnie-the-Pooh</title>
      <standard>
        <docmd:document xmlns:docmd="http://www.fcla.edu/docmd">
          <docmd:Language>en</docmd:Language>
        </docmd:document>
      </standard>
    </document>
  </metadata>
  <statistics fitsExecutionTime="617">
    <tool toolname="MediaInfo" toolversion="22.09" status="did not run" />
    <tool toolname="OIS Audio Information" toolversion="0.1" status="did not run" />
    <tool toolname="ADL Tool" toolversion="0.1" status="did not run" />
    <tool toolname="VTT Tool" toolversion="0.1" status="did not run" />
    <tool toolname="Droid" toolversion="6.5.2" executionTime="77" />
    <tool toolname="jpylyzer" toolversion="2.1.0" status="did not run" />
    <tool toolname="Jhove" toolversion="1.26.1" status="did not run" />
    <tool toolname="embARC" toolversion="0.2" status="did not run" />
    <tool toolname="file utility" toolversion="5.43" executionTime="221" />
    <tool toolname="Exiftool" toolversion="12.50" executionTime="599" />
    <tool toolname="NLNZ Metadata Extractor" toolversion="3.6GA" status="did not run" />
    <tool toolname="OIS File Information" toolversion="1.0" executionTime="240" />
    <tool toolname="OIS XML Metadata" toolversion="0.2" status="did not run" />
    <tool toolname="ffident" toolversion="0.2" executionTime="39" />
    <tool toolname="Tika" toolversion="2.6.0" executionTime="256" />
  </statistics>
</fits>
