<?xml version="1.0" encoding="UTF-8"?>
<fits xmlns="http://hul.harvard.edu/ois/xml/ns/fits/fits_output" xmlns:xsi="http://www.w3.org/2001/XMLSchema-instance" xsi:schemaLocation="http://hul.harvard.edu/ois/xml/ns/fits/fits_output https://some-other-pid-service/fits_output.xsd" version="1.6.0-SNAPSHOT" timestamp="1/12/23, 8:26 PM">
  <identification>
    <identity format="WordPerfect Document" mimetype="application/vnd.wordperfect" toolname="FITS" toolversion="1.6.0-SNAPSHOT">
      <tool toolname="Droid" toolversion="6.5.2" />
      <tool toolname="file utility" toolversion="5.43" />
      <tool toolname="NLNZ Metadata Extractor" toolversion="3.6GA" />
      <version toolname="Droid" toolversion="6.5.2">5.0</version>
      <externalIdentifier toolname="Droid" toolversion="6.5.2" type="puid">x-fmt/393</externalIdentifier>
    </identity>
  </identification>
  <fileinfo>
    <creatingApplicationName toolname="NLNZ Metadata Extractor" toolversion="3.6GA" status="SINGLE_RESULT">WordPerfect</creatingApplicationName>
    <creatingApplicationVersion toolname="NLNZ Metadata Extractor" toolversion="3.6GA" status="SINGLE_RESULT">5.0</creatingApplicationVersion>
    <filepath toolname="OIS File Information" toolversion="1.0" status="SINGLE_RESULT">/fits/testfiles/input/WordPerfect5_0.wp</filepath>
    <filename toolname="OIS File Information" toolversion="1.0" status="SINGLE_RESULT">WordPerfect5_0.wp</filename>
    <size toolname="OIS File Information" toolversion="1.0" status="SINGLE_RESULT">3329</size>
    <md5checksum toolname="OIS File Information" toolversion="1.0" status="SINGLE_RESULT">dd08b1df84b3d38736ac777795566b42</md5checksum>
    <fslastmodified toolname="OIS File Information" toolversion="1.0" status="SINGLE_RESULT">1667144388045</fslastmodified>
  </fileinfo>
  <filestatus />
  <metadata>
    <document>
      <title toolname="NLNZ Metadata Extractor" toolversion="3.6GA" status="SINGLE_RESULT">Kafka - Metamorphosis Sampel WP document</title>
      <author toolname="NLNZ Metadata Extractor" toolversion="3.6GA" status="SINGLE_RESULT">viz765</author>
      <standard>
        <docmd:document xmlns:docmd="http://www.fcla.edu/docmd" />
      </standard>
    </document>
  </metadata>
  <statistics fitsExecutionTime="382">
    <tool toolname="MediaInfo" toolversion="22.09" status="did not run" />
    <tool toolname="OIS Audio Information" toolversion="0.1" status="did not run" />
    <tool toolname="ADL Tool" toolversion="0.1" status="did not run" />
    <tool toolname="VTT Tool" toolversion="0.1" status="did not run" />
    <tool toolname="Droid" toolversion="6.5.2" executionTime="62" />
    <tool toolname="jpylyzer" toolversion="2.1.0" status="did not run" />
    <tool toolname="Jhove" toolversion="1.26.1" status="did not run" />
    <tool toolname="embARC" toolversion="0.2" status="did not run" />
    <tool toolname="file utility" toolversion="5.43" executionTime="136" />
    <tool toolname="Exiftool" toolversion="12.76" status="did not run" />
    <tool toolname="NLNZ Metadata Extractor" toolversion="3.6GA" executionTime="134" />
    <tool toolname="OIS File Information" toolversion="1.0" executionTime="54" />
    <tool toolname="OIS XML Metadata" toolversion="0.2" status="did not run" />
    <tool toolname="ffident" toolversion="0.2" executionTime="118" />
    <tool toolname="Tika" toolversion="2.6.0" executionTime="66" />
  </statistics>
</fits>
