<?xml version="1.0" encoding="UTF-8"?>
<fits xmlns="http://hul.harvard.edu/ois/xml/ns/fits/fits_output" xmlns:xsi="http://www.w3.org/2001/XMLSchema-instance" xsi:schemaLocation="http://hul.harvard.edu/ois/xml/ns/fits/fits_output https://some-other-pid-service/fits_output.xsd" version="1.6.0-SNAPSHOT" timestamp="1/12/23, 8:28 PM">
  <identification>
    <identity format="JPEG 2000 JP2" mimetype="image/jp2" toolname="FITS" toolversion="1.6.0-SNAPSHOT">
      <tool toolname="jpylyzer" toolversion="2.1.0" />
      <tool toolname="Tika" toolversion="2.6.0" />
    </identity>
  </identification>
  <fileinfo>
    <filepath toolname="OIS File Information" toolversion="1.0" status="SINGLE_RESULT">/fits/testfiles/input/binary.jp2</filepath>
    <filename toolname="OIS File Information" toolversion="1.0" status="SINGLE_RESULT">binary.jp2</filename>
    <size toolname="OIS File Information" toolversion="1.0">1024</size>
    <md5checksum toolname="OIS File Information" toolversion="1.0" status="SINGLE_RESULT">b40da7703d70dd7c71918802f56c5067</md5checksum>
    <fslastmodified toolname="OIS File Information" toolversion="1.0" status="SINGLE_RESULT">1669661668844</fslastmodified>
  </fileinfo>
  <filestatus>
    <well-formed toolname="jpylyzer" toolversion="2.1.0" status="SINGLE_RESULT">false</well-formed>
    <valid toolname="jpylyzer" toolversion="2.1.0" status="SINGLE_RESULT">false</valid>
  </filestatus>
  <metadata />
  <statistics fitsExecutionTime="387">
    <tool toolname="MediaInfo" toolversion="22.09" status="did not run" />
    <tool toolname="OIS Audio Information" toolversion="0.1" status="did not run" />
    <tool toolname="ADL Tool" toolversion="0.1" status="did not run" />
    <tool toolname="VTT Tool" toolversion="0.1" status="did not run" />
    <tool toolname="Droid" toolversion="6.5.2" executionTime="36" />
    <tool toolname="jpylyzer" toolversion="2.1.0" executionTime="203" />
    <tool toolname="Jhove" toolversion="1.26.1" executionTime="120" />
    <tool toolname="embARC" toolversion="0.2" status="did not run" />
    <tool toolname="file utility" toolversion="5.43" executionTime="177" />
    <tool toolname="Exiftool" toolversion="12.50" executionTime="351" />
    <tool toolname="NLNZ Metadata Extractor" toolversion="3.6GA" status="did not run" />
    <tool toolname="OIS File Information" toolversion="1.0" executionTime="21" />
    <tool toolname="OIS XML Metadata" toolversion="0.2" status="did not run" />
    <tool toolname="ffident" toolversion="0.2" executionTime="52" />
    <tool toolname="Tika" toolversion="2.6.0" executionTime="46" />
  </statistics>
</fits>
