<?xml version="1.0" encoding="UTF-8"?>
<fits xmlns="http://hul.harvard.edu/ois/xml/ns/fits/fits_output" xmlns:xsi="http://www.w3.org/2001/XMLSchema-instance" xsi:schemaLocation="http://hul.harvard.edu/ois/xml/ns/fits/fits_output https://some-other-pid-service/fits_output.xsd" version="1.6.0-SNAPSHOT" timestamp="1/12/23, 8:26 PM">
  <identification>
    <identity format="EPUB" mimetype="application/epub+zip" toolname="FITS" toolversion="1.6.0-SNAPSHOT">
      <tool toolname="Droid" toolversion="6.5.2" />
      <tool toolname="file utility" toolversion="5.43" />
      <tool toolname="Exiftool" toolversion="12.50" />
      <tool toolname="Tika" toolversion="2.6.0" />
      <externalIdentifier toolname="Droid" toolversion="6.5.2" type="puid">fmt/483</externalIdentifier>
    </identity>
  </identification>
  <fileinfo>
    <filepath toolname="OIS File Information" toolversion="1.0" status="SINGLE_RESULT">/fits/testfiles/input/epub30-test-font-embedding-obfuscation.epub</filepath>
    <filename toolname="OIS File Information" toolversion="1.0" status="SINGLE_RESULT">epub30-test-font-embedding-obfuscation.epub</filename>
    <size toolname="OIS File Information" toolversion="1.0">1176408</size>
    <md5checksum toolname="OIS File Information" toolversion="1.0" status="SINGLE_RESULT">8fcf4ac8f3ba4670ff204b200d1a910e</md5checksum>
    <fslastmodified toolname="OIS File Information" toolversion="1.0" status="SINGLE_RESULT">1667144388462</fslastmodified>
  </fileinfo>
  <filestatus />
  <metadata>
    <document>
      <title toolname="Exiftool" toolversion="12.50">EPUBTEST 0103 - Font Embedding and Obfuscation Tests</title>
      <author toolname="Exiftool" toolversion="12.50" status="SINGLE_RESULT">Markus Gylling, Vincent Gros, Toshiaki Koike, Marisa DeMeglio, Matt Garrish, Ori Idan</author>
      <isRightsManaged toolname="Exiftool" toolversion="12.50">yes</isRightsManaged>
      <description toolname="Exiftool" toolversion="12.50">Tests for Font Embedding and Obfuscation [UNDER CONSTRUCTION]</description>
      <identifier toolname="Exiftool" toolversion="12.50">com.github.epub-testsuite.epub30-test-0103</identifier>
      <language toolname="Exiftool" toolversion="12.50">en</language>
      <standard>
        <docmd:document xmlns:docmd="http://www.fcla.edu/docmd">
          <docmd:Language>en</docmd:Language>
        </docmd:document>
      </standard>
    </document>
  </metadata>
  <statistics fitsExecutionTime="963">
    <tool toolname="MediaInfo" toolversion="22.09" status="did not run" />
    <tool toolname="OIS Audio Information" toolversion="0.1" status="did not run" />
    <tool toolname="ADL Tool" toolversion="0.1" status="did not run" />
    <tool toolname="VTT Tool" toolversion="0.1" status="did not run" />
    <tool toolname="Droid" toolversion="6.5.2" executionTime="101" />
    <tool toolname="jpylyzer" toolversion="2.1.0" status="did not run" />
    <tool toolname="Jhove" toolversion="1.26.1" status="did not run" />
    <tool toolname="embARC" toolversion="0.2" status="did not run" />
    <tool toolname="file utility" toolversion="5.43" executionTime="181" />
    <tool toolname="Exiftool" toolversion="12.50" executionTime="953" />
    <tool toolname="NLNZ Metadata Extractor" toolversion="3.6GA" status="did not run" />
    <tool toolname="OIS File Information" toolversion="1.0" executionTime="85" />
    <tool toolname="OIS XML Metadata" toolversion="0.2" status="did not run" />
    <tool toolname="ffident" toolversion="0.2" executionTime="93" />
    <tool toolname="Tika" toolversion="2.6.0" executionTime="176" />
  </statistics>
</fits>
