<?xml version="1.0" encoding="UTF-8"?>
<fits xmlns="http://hul.harvard.edu/ois/xml/ns/fits/fits_output" xmlns:xsi="http://www.w3.org/2001/XMLSchema-instance" xsi:schemaLocation="http://hul.harvard.edu/ois/xml/ns/fits/fits_output https://some-other-pid-service/fits_output.xsd" version="1.6.0-SNAPSHOT" timestamp="1/12/23, 8:26 PM">
  <identification>
    <identity format="Rich Text Format (RTF)" mimetype="application/rtf" toolname="FITS" toolversion="1.6.0-SNAPSHOT">
      <tool toolname="Droid" toolversion="6.5.2" />
      <tool toolname="file utility" toolversion="5.43" />
      <tool toolname="Exiftool" toolversion="12.50" />
      <tool toolname="Tika" toolversion="2.6.0" />
      <version toolname="Droid" toolversion="6.5.2">1.9</version>
      <externalIdentifier toolname="Droid" toolversion="6.5.2" type="puid">fmt/355</externalIdentifier>
    </identity>
  </identification>
  <fileinfo>
    <lastmodified toolname="Exiftool" toolversion="12.50" status="SINGLE_RESULT">2015-09-24T12:17:00</lastmodified>
    <created toolname="Exiftool" toolversion="12.50" status="CONFLICT">2015-09-24T12:16:00</created>
    <created toolname="Tika" toolversion="2.6.0" status="CONFLICT">2015-09-24T16:16:00Z</created>
    <filepath toolname="OIS File Information" toolversion="1.0" status="SINGLE_RESULT">/fits/testfiles/input/Doc2.rtf</filepath>
    <filename toolname="OIS File Information" toolversion="1.0" status="SINGLE_RESULT">Doc2.rtf</filename>
    <size toolname="OIS File Information" toolversion="1.0">26328</size>
    <md5checksum toolname="OIS File Information" toolversion="1.0" status="SINGLE_RESULT">26301ff11c920c4e32f9fa7d706390a6</md5checksum>
    <fslastmodified toolname="OIS File Information" toolversion="1.0" status="SINGLE_RESULT">1667144387463</fslastmodified>
  </fileinfo>
  <filestatus />
  <metadata>
    <document>
      <pageCount toolname="Exiftool" toolversion="12.50">1</pageCount>
      <wordCount toolname="Exiftool" toolversion="12.50">0</wordCount>
      <characterCount toolname="Exiftool" toolversion="12.50">0</characterCount>
      <author toolname="Exiftool" toolversion="12.50">Aloisio, Paul G.</author>
      <standard>
        <docmd:document xmlns:docmd="http://www.fcla.edu/docmd">
          <docmd:PageCount>1</docmd:PageCount>
          <docmd:WordCount>0</docmd:WordCount>
          <docmd:CharacterCount>0</docmd:CharacterCount>
        </docmd:document>
      </standard>
    </document>
  </metadata>
  <statistics fitsExecutionTime="276">
    <tool toolname="MediaInfo" toolversion="22.09" status="did not run" />
    <tool toolname="OIS Audio Information" toolversion="0.1" status="did not run" />
    <tool toolname="ADL Tool" toolversion="0.1" status="did not run" />
    <tool toolname="VTT Tool" toolversion="0.1" status="did not run" />
    <tool toolname="Droid" toolversion="6.5.2" executionTime="29" />
    <tool toolname="jpylyzer" toolversion="2.1.0" status="did not run" />
    <tool toolname="Jhove" toolversion="1.26.1" status="did not run" />
    <tool toolname="embARC" toolversion="0.2" status="did not run" />
    <tool toolname="file utility" toolversion="5.43" executionTime="123" />
    <tool toolname="Exiftool" toolversion="12.50" executionTime="266" />
    <tool toolname="NLNZ Metadata Extractor" toolversion="3.6GA" status="did not run" />
    <tool toolname="OIS File Information" toolversion="1.0" executionTime="53" />
    <tool toolname="OIS XML Metadata" toolversion="0.2" status="did not run" />
    <tool toolname="ffident" toolversion="0.2" status="did not run" />
    <tool toolname="Tika" toolversion="2.6.0" executionTime="51" />
  </statistics>
</fits>
