<?xml version="1.0" encoding="UTF-8"?>
<fits xmlns="http://hul.harvard.edu/ois/xml/ns/fits/fits_output" xmlns:xsi="http://www.w3.org/2001/XMLSchema-instance" xsi:schemaLocation="http://hul.harvard.edu/ois/xml/ns/fits/fits_output https://some-other-pid-service/fits_output.xsd" version="1.6.0-SNAPSHOT" timestamp="1/12/23, 8:26 PM">
  <identification>
    <identity format="Microsoft Word Binary File Format" mimetype="application/msword" toolname="FITS" toolversion="1.6.0-SNAPSHOT">
      <tool toolname="Droid" toolversion="6.5.2" />
      <tool toolname="file utility" toolversion="5.43" />
      <tool toolname="Tika" toolversion="2.6.0" />
      <version toolname="Droid" toolversion="6.5.2">4.0</version>
      <externalIdentifier toolname="Droid" toolversion="6.5.2" type="puid">x-fmt/64</externalIdentifier>
    </identity>
  </identification>
  <fileinfo>
    <filepath toolname="OIS File Information" toolversion="1.0" status="SINGLE_RESULT">/fits/testfiles/input/MacMSWORD_4-5.doc</filepath>
    <filename toolname="OIS File Information" toolversion="1.0" status="SINGLE_RESULT">MacMSWORD_4-5.doc</filename>
    <size toolname="OIS File Information" toolversion="1.0">2047</size>
    <md5checksum toolname="OIS File Information" toolversion="1.0" status="SINGLE_RESULT">edc1036fd68b60ba62af22aa269fc0a8</md5checksum>
    <fslastmodified toolname="OIS File Information" toolversion="1.0" status="SINGLE_RESULT">1667144387814</fslastmodified>
  </fileinfo>
  <filestatus />
  <metadata />
  <statistics fitsExecutionTime="421">
    <tool toolname="MediaInfo" toolversion="22.09" status="did not run" />
    <tool toolname="OIS Audio Information" toolversion="0.1" status="did not run" />
    <tool toolname="ADL Tool" toolversion="0.1" status="did not run" />
    <tool toolname="VTT Tool" toolversion="0.1" status="did not run" />
    <tool toolname="Droid" toolversion="6.5.2" executionTime="39" />
    <tool toolname="jpylyzer" toolversion="2.1.0" status="did not run" />
    <tool toolname="Jhove" toolversion="1.26.1" status="did not run" />
    <tool toolname="embARC" toolversion="0.2" status="did not run" />
    <tool toolname="file utility" toolversion="5.43" executionTime="137" />
    <tool toolname="Exiftool" toolversion="12.50" executionTime="408" />
    <tool toolname="NLNZ Metadata Extractor" toolversion="3.6GA" executionTime="357" />
    <tool toolname="OIS File Information" toolversion="1.0" executionTime="27" />
    <tool toolname="OIS XML Metadata" toolversion="0.2" status="did not run" />
    <tool toolname="ffident" toolversion="0.2" executionTime="56" />
    <tool toolname="Tika" toolversion="2.6.0" executionTime="41" />
  </statistics>
</fits>
