<?xml version="1.0" encoding="UTF-8"?>
<fits xmlns="http://hul.harvard.edu/ois/xml/ns/fits/fits_output" xmlns:xsi="http://www.w3.org/2001/XMLSchema-instance" xsi:schemaLocation="http://hul.harvard.edu/ois/xml/ns/fits/fits_output https://some-other-pid-service/fits_output.xsd" version="1.6.0-SNAPSHOT" timestamp="1/12/23, 8:30 PM">
  <identification>
    <identity format="WebVTT" mimetype="text/vtt" toolname="FITS" toolversion="1.6.0-SNAPSHOT">
      <tool toolname="VTT Tool" toolversion="0.1" />
      <tool toolname="Droid" toolversion="6.5.2" />
      <tool toolname="file utility" toolversion="5.43" />
      <externalIdentifier toolname="Droid" toolversion="6.5.2" type="puid">fmt/1454</externalIdentifier>
    </identity>
  </identification>
  <fileinfo>
    <size toolname="Jhove" toolversion="1.26.1">488</size>
    <filepath toolname="OIS File Information" toolversion="1.0" status="SINGLE_RESULT">/fits/testfiles/input/simple_webvtt.vtt</filepath>
    <filename toolname="OIS File Information" toolversion="1.0" status="SINGLE_RESULT">simple_webvtt.vtt</filename>
    <md5checksum toolname="OIS File Information" toolversion="1.0" status="SINGLE_RESULT">6fd0c9caa00b08305344cc42244666af</md5checksum>
    <fslastmodified toolname="OIS File Information" toolversion="1.0" status="SINGLE_RESULT">1667144388573</fslastmodified>
  </fileinfo>
  <filestatus>
    <well-formed toolname="Jhove" toolversion="1.26.1" status="SINGLE_RESULT">true</well-formed>
    <valid toolname="Jhove" toolversion="1.26.1" status="SINGLE_RESULT">true</valid>
  </filestatus>
  <metadata>
    <text>
      <linebreak toolname="Jhove" toolversion="1.26.1" status="SINGLE_RESULT">LF</linebreak>
      <charset toolname="Jhove" toolversion="1.26.1" status="SINGLE_RESULT">US-ASCII</charset>
      <standard>
        <textMD:textMD xmlns:textMD="info:lc/xmlns/textMD-v3">
          <textMD:character_info>
            <textMD:charset>US-ASCII</textMD:charset>
            <textMD:linebreak>LF</textMD:linebreak>
          </textMD:character_info>
        </textMD:textMD>
      </standard>
    </text>
  </metadata>
  <statistics fitsExecutionTime="355">
    <tool toolname="MediaInfo" toolversion="22.09" status="did not run" />
    <tool toolname="OIS Audio Information" toolversion="0.1" status="did not run" />
    <tool toolname="ADL Tool" toolversion="0.1" status="did not run" />
    <tool toolname="VTT Tool" toolversion="0.1" executionTime="55" />
    <tool toolname="Droid" toolversion="6.5.2" executionTime="312" />
    <tool toolname="jpylyzer" toolversion="2.1.0" status="did not run" />
    <tool toolname="Jhove" toolversion="1.26.1" executionTime="348" />
    <tool toolname="embARC" toolversion="0.2" status="did not run" />
    <tool toolname="file utility" toolversion="5.43" executionTime="165" />
    <tool toolname="Exiftool" toolversion="12.50" status="did not run" />
    <tool toolname="NLNZ Metadata Extractor" toolversion="3.6GA" status="did not run" />
    <tool toolname="OIS File Information" toolversion="1.0" executionTime="66" />
    <tool toolname="OIS XML Metadata" toolversion="0.2" status="did not run" />
    <tool toolname="ffident" toolversion="0.2" executionTime="137" />
    <tool toolname="Tika" toolversion="2.6.0" status="did not run" />
  </statistics>
</fits>
