<?xml version="1.0" encoding="UTF-8"?>
<fits xmlns="http://hul.harvard.edu/ois/xml/ns/fits/fits_output" xmlns:xsi="http://www.w3.org/2001/XMLSchema-instance" xsi:schemaLocation="http://hul.harvard.edu/ois/xml/ns/fits/fits_output https://some-other-pid-service/fits_output.xsd" version="1.6.0-SNAPSHOT" timestamp="1/12/23, 8:26 PM">
  <identification status="SINGLE_RESULT">
    <identity format="WordPerfect Document" mimetype="application/vnd.wordperfect" toolname="FITS" toolversion="1.6.0-SNAPSHOT">
      <tool toolname="Droid" toolversion="6.5.2" />
      <version toolname="Droid" toolversion="6.5.2" status="CONFLICT">5.2</version>
      <version toolname="Droid" toolversion="6.5.2" status="CONFLICT">6 onwards</version>
      <externalIdentifier toolname="Droid" toolversion="6.5.2" type="puid">x-fmt/203</externalIdentifier>
      <externalIdentifier toolname="Droid" toolversion="6.5.2" type="puid">fmt/892</externalIdentifier>
    </identity>
  </identification>
  <fileinfo>
    <filepath toolname="OIS File Information" toolversion="1.0" status="SINGLE_RESULT">/fits/testfiles/input/WordPerfect4_2.wp</filepath>
    <filename toolname="OIS File Information" toolversion="1.0" status="SINGLE_RESULT">WordPerfect4_2.wp</filename>
    <size toolname="OIS File Information" toolversion="1.0" status="SINGLE_RESULT">2677</size>
    <md5checksum toolname="OIS File Information" toolversion="1.0" status="SINGLE_RESULT">a83edcaa67ad6338bbfee877815df532</md5checksum>
    <fslastmodified toolname="OIS File Information" toolversion="1.0" status="SINGLE_RESULT">1667144388044</fslastmodified>
  </fileinfo>
  <filestatus />
  <metadata />
  <statistics fitsExecutionTime="628">
    <tool toolname="MediaInfo" toolversion="22.09" status="did not run" />
    <tool toolname="OIS Audio Information" toolversion="0.1" status="did not run" />
    <tool toolname="ADL Tool" toolversion="0.1" status="did not run" />
    <tool toolname="VTT Tool" toolversion="0.1" status="did not run" />
    <tool toolname="Droid" toolversion="6.5.2" executionTime="75" />
    <tool toolname="jpylyzer" toolversion="2.1.0" status="did not run" />
    <tool toolname="Jhove" toolversion="1.26.1" status="did not run" />
    <tool toolname="embARC" toolversion="0.2" status="did not run" />
    <tool toolname="file utility" toolversion="5.43" executionTime="172" />
    <tool toolname="Exiftool" toolversion="12.76" status="did not run" />
    <tool toolname="NLNZ Metadata Extractor" toolversion="3.6GA" executionTime="617" />
    <tool toolname="OIS File Information" toolversion="1.0" executionTime="88" />
    <tool toolname="OIS XML Metadata" toolversion="0.2" status="did not run" />
    <tool toolname="ffident" toolversion="0.2" executionTime="98" />
    <tool toolname="Tika" toolversion="2.6.0" executionTime="76" />
  </statistics>
</fits>
