<?xml version="1.0" encoding="UTF-8"?>
<fits xmlns="http://hul.harvard.edu/ois/xml/ns/fits/fits_output" xmlns:xsi="http://www.w3.org/2001/XMLSchema-instance" xsi:schemaLocation="http://hul.harvard.edu/ois/xml/ns/fits/fits_output https://some-other-pid-service/fits_output.xsd" version="1.6.0-SNAPSHOT" timestamp="1/12/23, 8:26 PM">
  <identification>
    <identity format="Microsoft Excel" mimetype="application/vnd.ms-excel" toolname="FITS" toolversion="1.6.0-SNAPSHOT">
      <tool toolname="Droid" toolversion="6.5.2" />
      <tool toolname="file utility" toolversion="5.43" />
      <tool toolname="Exiftool" toolversion="12.50" />
      <tool toolname="ffident" toolversion="0.2" />
      <tool toolname="Tika" toolversion="2.6.0" />
      <version toolname="Droid" toolversion="6.5.2">8</version>
      <externalIdentifier toolname="Droid" toolversion="6.5.2" type="puid">fmt/61</externalIdentifier>
    </identity>
  </identification>
  <fileinfo>
    <created toolname="Exiftool" toolversion="12.50" status="CONFLICT">1998-12-08T14:22:55</created>
    <created toolname="Tika" toolversion="2.6.0" status="CONFLICT">1998-12-08T14:22:55Z</created>
    <creatingApplicationName toolname="Tika" toolversion="2.6.0" status="SINGLE_RESULT">Microsoft Excel</creatingApplicationName>
    <filepath toolname="OIS File Information" toolversion="1.0" status="SINGLE_RESULT">/fits/testfiles/input/valid.xls</filepath>
    <filename toolname="OIS File Information" toolversion="1.0" status="SINGLE_RESULT">valid.xls</filename>
    <size toolname="OIS File Information" toolversion="1.0">270336</size>
    <md5checksum toolname="OIS File Information" toolversion="1.0" status="SINGLE_RESULT">fa11d8719f82d99f034a9ab2e52ac446</md5checksum>
    <fslastmodified toolname="OIS File Information" toolversion="1.0" status="SINGLE_RESULT">1667144388816</fslastmodified>
  </fileinfo>
  <filestatus />
  <metadata>
    <document>
      <title toolname="Exiftool" toolversion="12.50">Validatie 1</title>
      <author toolname="Exiftool" toolversion="12.50">Johan van der Knijff</author>
      <standard>
        <docmd:document xmlns:docmd="http://www.fcla.edu/docmd" />
      </standard>
    </document>
  </metadata>
  <statistics fitsExecutionTime="879">
    <tool toolname="MediaInfo" toolversion="22.09" status="did not run" />
    <tool toolname="OIS Audio Information" toolversion="0.1" status="did not run" />
    <tool toolname="ADL Tool" toolversion="0.1" status="did not run" />
    <tool toolname="VTT Tool" toolversion="0.1" status="did not run" />
    <tool toolname="Droid" toolversion="6.5.2" executionTime="157" />
    <tool toolname="jpylyzer" toolversion="2.1.0" status="did not run" />
    <tool toolname="Jhove" toolversion="1.26.1" executionTime="819" />
    <tool toolname="embARC" toolversion="0.2" status="did not run" />
    <tool toolname="file utility" toolversion="5.43" executionTime="251" />
    <tool toolname="Exiftool" toolversion="12.50" executionTime="857" />
    <tool toolname="NLNZ Metadata Extractor" toolversion="3.6GA" status="did not run" />
    <tool toolname="OIS File Information" toolversion="1.0" executionTime="151" />
    <tool toolname="OIS XML Metadata" toolversion="0.2" status="did not run" />
    <tool toolname="ffident" toolversion="0.2" executionTime="149" />
    <tool toolname="Tika" toolversion="2.6.0" executionTime="768" />
  </statistics>
</fits>
