<?xml version="1.0" encoding="UTF-8"?>
<fits xmlns="http://hul.harvard.edu/ois/xml/ns/fits/fits_output" xmlns:xsi="http://www.w3.org/2001/XMLSchema-instance" xsi:schemaLocation="http://hul.harvard.edu/ois/xml/ns/fits/fits_output https://some-other-pid-service/fits_output.xsd" version="1.6.0-SNAPSHOT" timestamp="1/12/23, 8:26 PM">
  <identification>
    <identity format="Office Open XML Presentation" mimetype="application/vnd.openxmlformats-officedocument.presentationml.presentation" toolname="FITS" toolversion="1.6.0-SNAPSHOT">
      <tool toolname="Droid" toolversion="6.5.2" />
      <tool toolname="file utility" toolversion="5.43" />
      <tool toolname="Exiftool" toolversion="12.50" />
      <tool toolname="Tika" toolversion="2.6.0" />
      <version toolname="Droid" toolversion="6.5.2">2007 onwards</version>
      <externalIdentifier toolname="Droid" toolversion="6.5.2" type="puid">fmt/215</externalIdentifier>
    </identity>
  </identification>
  <fileinfo>
    <lastmodified toolname="Exiftool" toolversion="12.50">2009-05-06T22:13:30Z</lastmodified>
    <created toolname="Exiftool" toolversion="12.50">2009-05-06T22:06:09Z</created>
    <creatingApplicationName toolname="Tika" toolversion="2.6.0" status="SINGLE_RESULT">Microsoft Office PowerPoint</creatingApplicationName>
    <creatingApplicationVersion toolname="Tika" toolversion="2.6.0" status="SINGLE_RESULT">12.0000</creatingApplicationVersion>
    <filepath toolname="OIS File Information" toolversion="1.0" status="SINGLE_RESULT">/fits/testfiles/input/samplepptx.pptx</filepath>
    <filename toolname="OIS File Information" toolversion="1.0" status="SINGLE_RESULT">samplepptx.pptx</filename>
    <size toolname="OIS File Information" toolversion="1.0">413895</size>
    <md5checksum toolname="OIS File Information" toolversion="1.0" status="SINGLE_RESULT">72432c9fb76cf45094c29fc92c4b16f0</md5checksum>
    <fslastmodified toolname="OIS File Information" toolversion="1.0" status="SINGLE_RESULT">1667144388572</fslastmodified>
  </fileinfo>
  <filestatus />
  <metadata>
    <document>
      <pageCount toolname="Tika" toolversion="2.6.0" status="SINGLE_RESULT">2</pageCount>
      <wordCount toolname="Exiftool" toolversion="12.50">30</wordCount>
      <title toolname="Exiftool" toolversion="12.50">Sample PowerPoint File</title>
      <author toolname="Exiftool" toolversion="12.50">James Falkofske</author>
      <paragraphCount toolname="Exiftool" toolversion="12.50">5</paragraphCount>
      <standard>
        <docmd:document xmlns:docmd="http://www.fcla.edu/docmd">
          <docmd:PageCount>2</docmd:PageCount>
          <docmd:WordCount>30</docmd:WordCount>
          <docmd:ParagraphCount>5</docmd:ParagraphCount>
        </docmd:document>
      </standard>
    </document>
  </metadata>
  <statistics fitsExecutionTime="1721">
    <tool toolname="MediaInfo" toolversion="22.09" status="did not run" />
    <tool toolname="OIS Audio Information" toolversion="0.1" status="did not run" />
    <tool toolname="ADL Tool" toolversion="0.1" status="did not run" />
    <tool toolname="VTT Tool" toolversion="0.1" status="did not run" />
    <tool toolname="Droid" toolversion="6.5.2" executionTime="134" />
    <tool toolname="jpylyzer" toolversion="2.1.0" status="did not run" />
    <tool toolname="Jhove" toolversion="1.26.1" executionTime="633" />
    <tool toolname="embARC" toolversion="0.2" status="did not run" />
    <tool toolname="file utility" toolversion="5.43" executionTime="178" />
    <tool toolname="Exiftool" toolversion="12.50" executionTime="904" />
    <tool toolname="NLNZ Metadata Extractor" toolversion="3.6GA" status="did not run" />
    <tool toolname="OIS File Information" toolversion="1.0" executionTime="56" />
    <tool toolname="OIS XML Metadata" toolversion="0.2" status="did not run" />
    <tool toolname="ffident" toolversion="0.2" executionTime="120" />
    <tool toolname="Tika" toolversion="2.6.0" executionTime="1696" />
  </statistics>
</fits>
