<?xml version="1.0" encoding="UTF-8"?>
<fits xmlns="http://hul.harvard.edu/ois/xml/ns/fits/fits_output" xmlns:xsi="http://www.w3.org/2001/XMLSchema-instance" xsi:schemaLocation="http://hul.harvard.edu/ois/xml/ns/fits/fits_output https://some-other-pid-service/fits_output.xsd" version="1.6.0-SNAPSHOT" timestamp="1/12/23, 8:32 PM">
  <identification>
    <identity format="ZIP Format" mimetype="application/zip" toolname="FITS" toolversion="1.6.0-SNAPSHOT">
      <tool toolname="Droid" toolversion="6.5.2" />
      <tool toolname="file utility" toolversion="5.43" />
      <tool toolname="Exiftool" toolversion="12.50" />
      <tool toolname="ffident" toolversion="0.2" />
      <tool toolname="Tika" toolversion="2.6.0" />
      <version toolname="file utility" toolversion="5.43">1.0</version>
      <externalIdentifier toolname="Droid" toolversion="6.5.2" type="puid">x-fmt/263</externalIdentifier>
    </identity>
  </identification>
  <fileinfo>
    <filepath toolname="OIS File Information" toolversion="1.0" status="SINGLE_RESULT">/fits/testfiles/input/assorted-files.zip</filepath>
    <filename toolname="OIS File Information" toolversion="1.0" status="SINGLE_RESULT">assorted-files.zip</filename>
    <size toolname="OIS File Information" toolversion="1.0">30400659</size>
    <md5checksum toolname="OIS File Information" toolversion="1.0" status="SINGLE_RESULT">381dd28336fef8e188ebec5c6c29c596</md5checksum>
    <fslastmodified toolname="OIS File Information" toolversion="1.0" status="SINGLE_RESULT">1667144388319</fslastmodified>
  </fileinfo>
  <filestatus />
  <metadata>
    <container>
      <originalSize toolname="Droid" toolversion="6.5.2" status="SINGLE_RESULT">34318329</originalSize>
      <compressionMethod toolname="Droid" toolversion="6.5.2" status="SINGLE_RESULT">deflate</compressionMethod>
      <entries totalEntries="16" toolname="Droid" toolversion="6.5.2" status="SINGLE_RESULT">
        <format name="EPUB" number="1" />
        <format name="Extensible Markup Language" number="1" />
        <format name="Graphics Interchange Format" number="1" />
        <format name="JPEG 2000 JP2" number="1" />
        <format name="JPEG File Interchange Format" number="1" />
        <format name="MPEG-4" number="1" />
        <format name="Office Open XML Document" number="1" />
        <format name="OpenDocument Text" number="1" />
        <format name="PDF/A" number="1" />
        <format name="PDF/X" number="1" />
        <format name="Plain text" number="1" />
        <format name="Portable Network Graphics" number="1" />
        <format name="Rich Text Format (RTF)" number="1" />
        <format name="TIFF EXIF" number="1" />
        <format name="Waveform Audio" number="1" />
        <format name="ZIP Format" number="1" />
      </entries>
    </container>
  </metadata>
  <statistics fitsExecutionTime="5720">
    <tool toolname="MediaInfo" toolversion="22.09" status="did not run" />
    <tool toolname="OIS Audio Information" toolversion="0.1" status="did not run" />
    <tool toolname="ADL Tool" toolversion="0.1" status="did not run" />
    <tool toolname="VTT Tool" toolversion="0.1" status="did not run" />
    <tool toolname="Droid" toolversion="6.5.2" executionTime="1388" />
    <tool toolname="jpylyzer" toolversion="2.1.0" status="did not run" />
    <tool toolname="Jhove" toolversion="1.26.1" status="did not run" />
    <tool toolname="embARC" toolversion="0.2" status="did not run" />
    <tool toolname="file utility" toolversion="5.43" executionTime="142" />
    <tool toolname="Exiftool" toolversion="12.50" executionTime="862" />
    <tool toolname="NLNZ Metadata Extractor" toolversion="3.6GA" status="did not run" />
    <tool toolname="OIS File Information" toolversion="1.0" executionTime="690" />
    <tool toolname="OIS XML Metadata" toolversion="0.2" status="did not run" />
    <tool toolname="ffident" toolversion="0.2" executionTime="78" />
    <tool toolname="Tika" toolversion="2.6.0" executionTime="5708" />
  </statistics>
</fits>
