<?xml version="1.0" encoding="UTF-8"?>
<fits xmlns="http://hul.harvard.edu/ois/xml/ns/fits/fits_output" xmlns:xsi="http://www.w3.org/2001/XMLSchema-instance" xsi:schemaLocation="http://hul.harvard.edu/ois/xml/ns/fits/fits_output https://some-other-pid-service/fits_output.xsd" version="1.6.0-SNAPSHOT" timestamp="1/12/23, 8:29 PM">
  <identification>
    <identity format="Plain text" mimetype="text/plain" toolname="FITS" toolversion="1.6.0-SNAPSHOT">
      <tool toolname="Droid" toolversion="6.5.2" />
      <tool toolname="file utility" toolversion="5.43" />
      <tool toolname="Exiftool" toolversion="12.50" />
      <tool toolname="Tika" toolversion="2.6.0" />
      <externalIdentifier toolname="Droid" toolversion="6.5.2" type="puid">x-fmt/111</externalIdentifier>
    </identity>
  </identification>
  <fileinfo>
    <filepath toolname="OIS File Information" toolversion="1.0" status="SINGLE_RESULT">/fits/testfiles/input/utf16.txt</filepath>
    <filename toolname="OIS File Information" toolversion="1.0" status="SINGLE_RESULT">utf16.txt</filename>
    <size toolname="OIS File Information" toolversion="1.0">30</size>
    <md5checksum toolname="OIS File Information" toolversion="1.0" status="SINGLE_RESULT">fbb8ef84677fad5a798cef6cf69aef1d</md5checksum>
    <fslastmodified toolname="OIS File Information" toolversion="1.0" status="SINGLE_RESULT">1667144388814</fslastmodified>
  </fileinfo>
  <filestatus />
  <metadata>
    <text>
      <charset toolname="file utility" toolversion="5.43">UTF-16LE</charset>
      <standard>
        <textMD:textMD xmlns:textMD="info:lc/xmlns/textMD-v3">
          <textMD:character_info>
            <textMD:charset>UTF-16LE</textMD:charset>
          </textMD:character_info>
        </textMD:textMD>
      </standard>
    </text>
  </metadata>
  <statistics fitsExecutionTime="288">
    <tool toolname="MediaInfo" toolversion="22.09" status="did not run" />
    <tool toolname="OIS Audio Information" toolversion="0.1" status="did not run" />
    <tool toolname="ADL Tool" toolversion="0.1" status="did not run" />
    <tool toolname="VTT Tool" toolversion="0.1" status="did not run" />
    <tool toolname="Droid" toolversion="6.5.2" executionTime="52" />
    <tool toolname="jpylyzer" toolversion="2.1.0" status="did not run" />
    <tool toolname="Jhove" toolversion="1.26.1" executionTime="155" />
    <tool toolname="embARC" toolversion="0.2" status="did not run" />
    <tool toolname="file utility" toolversion="5.43" executionTime="128" />
    <tool toolname="Exiftool" toolversion="12.50" executionTime="280" />
    <tool toolname="NLNZ Metadata Extractor" toolversion="3.6GA" status="did not run" />
    <tool toolname="OIS File Information" toolversion="1.0" executionTime="55" />
    <tool toolname="OIS XML Metadata" toolversion="0.2" status="did not run" />
    <tool toolname="ffident" toolversion="0.2" executionTime="80" />
    <tool toolname="Tika" toolversion="2.6.0" executionTime="89" />
  </statistics>
</fits>
