<?xml version="1.0" encoding="UTF-8"?>
<fits xmlns="http://hul.harvard.edu/ois/xml/ns/fits/fits_output" xmlns:xsi="http://www.w3.org/2001/XMLSchema-instance" xsi:schemaLocation="http://hul.harvard.edu/ois/xml/ns/fits/fits_output https://some-other-pid-service/fits_output.xsd" version="1.6.0-SNAPSHOT" timestamp="1/12/23, 8:26 PM">
  <identification status="CONFLICT">
    <identity format="OLE 2 Compound Document, v3.62, SecID 0x1, 11 FAT sectors, Mini FAT start sector 0x2 : UNKNOWN with names EncryptedPackage \006DataSpaces Version" mimetype="application/x-ole-storage" toolname="FITS" toolversion="1.6.0-SNAPSHOT">
      <tool toolname="file utility" toolversion="5.43" />
    </identity>
    <identity format="Office Open XML Document" mimetype="application/vnd.openxmlformats-officedocument.wordprocessingml.document" toolname="FITS" toolversion="1.6.0-SNAPSHOT">
      <tool toolname="Exiftool" toolversion="12.50" />
    </identity>
    <identity format="Microsoft Excel" mimetype="application/vnd.ms-excel" toolname="FITS" toolversion="1.6.0-SNAPSHOT">
      <tool toolname="ffident" toolversion="0.2" />
    </identity>
    <identity format="Password Protected OOXML File" mimetype="application/x-tika-ooxml-protected" toolname="FITS" toolversion="1.6.0-SNAPSHOT">
      <tool toolname="Tika" toolversion="2.6.0" />
    </identity>
  </identification>
  <fileinfo>
    <filepath toolname="OIS File Information" toolversion="1.0" status="SINGLE_RESULT">/fits/testfiles/input/WordPasswordProtected.docx</filepath>
    <filename toolname="OIS File Information" toolversion="1.0" status="SINGLE_RESULT">WordPasswordProtected.docx</filename>
    <size toolname="OIS File Information" toolversion="1.0">242176</size>
    <md5checksum toolname="OIS File Information" toolversion="1.0" status="SINGLE_RESULT">bfc6125db60e834e6b9e7210970a6233</md5checksum>
    <fslastmodified toolname="OIS File Information" toolversion="1.0" status="SINGLE_RESULT">1667144388043</fslastmodified>
  </fileinfo>
  <filestatus />
  <metadata>
    <document />
  </metadata>
  <statistics fitsExecutionTime="314">
    <tool toolname="MediaInfo" toolversion="22.09" status="did not run" />
    <tool toolname="OIS Audio Information" toolversion="0.1" status="did not run" />
    <tool toolname="ADL Tool" toolversion="0.1" status="did not run" />
    <tool toolname="VTT Tool" toolversion="0.1" status="did not run" />
    <tool toolname="Droid" toolversion="6.5.2" executionTime="84" />
    <tool toolname="jpylyzer" toolversion="2.1.0" status="did not run" />
    <tool toolname="Jhove" toolversion="1.26.1" status="did not run" />
    <tool toolname="embARC" toolversion="0.2" status="did not run" />
    <tool toolname="file utility" toolversion="5.43" executionTime="144" />
    <tool toolname="Exiftool" toolversion="12.50" executionTime="307" />
    <tool toolname="NLNZ Metadata Extractor" toolversion="3.6GA" status="did not run" />
    <tool toolname="OIS File Information" toolversion="1.0" executionTime="78" />
    <tool toolname="OIS XML Metadata" toolversion="0.2" status="did not run" />
    <tool toolname="ffident" toolversion="0.2" executionTime="91" />
    <tool toolname="Tika" toolversion="2.6.0" executionTime="218" />
  </statistics>
</fits>
